{
  "mission_id": "P2.5",
  "role": "IMPLEMENTER",
  "subject": "US-0001",
  "user_story_id": "US-0001",
  "observed_commit": "b633fd9b7ea9ec2cee8c0c176c6e7dab7c03e9f9",
  "summary": "Implemented the assigned behavior within scope.",
  "files_changed": ["src/feature.py", "tests/test_feature.py"],
  "tests_added_or_modified": ["tests/test_feature.py"],
  "verification_commands": ["python -m pytest tests/test_feature.py"],
  "verification_results": [
    {
      "command": "python -m pytest tests/test_feature.py",
      "required": true,
      "result": "PASS",
      "exit_code": 0,
      "details": "1 passed"
    }
  ],
  "assumptions": [],
  "findings": [],
  "blockers": [],
  "recommended_next_role": "TESTER",
  "verdict": "READY_FOR_TEST"
}
